{
  "$schema": "./screens.schema.json",
  "$comment": "The app's screen contract, read by screen-contracts' check-screens.mjs and list-screen.mjs (and by design-visual-parity for its screenshot checks). One entry per screen, dialog and overlay: where its route, model hook, view and test live, its states (the default first; drawn: false marks a state the design does not draw, with its why), and every element with its testID, role, component and copy keys. A new testID, state or screen is a change here first, reviewed like code. Filled for the reference Tasks app: the tasks entry describes that app's existing Tasks screen (its code is not part of this template), lists and delete-list-dialog are the screens the templates build; replace all three with the app's own screens.",
  "version": 1,
  "references": "design/screens",
  "policies": {
    "primaryAction": {
      "max": 1,
      "match": [
        {
          "component": "Button",
          "prop": "variant",
          "value": "primary"
        }
      ]
    },
    "adSlot": {
      "components": ["AdBannerSlot"],
      "screens": ["tasks"]
    },
    "modalRoots": ["Modal", "Scrim"],
    "retiredKeys": {}
  },
  "screens": [
    {
      "id": "tasks",
      "name": "Tasks",
      "presentation": "route",
      "route": "src/app/(app)/index.tsx",
      "model": "src/features/tasks/use-tasks-model.ts",
      "view": "src/features/tasks/tasks-screen.tsx",
      "states": [
        {
          "id": "default"
        }
      ],
      "elements": [
        {
          "testID": "tasks.list",
          "role": "list",
          "component": "FlatList"
        },
        {
          "testID": "tasks.summary",
          "role": "text",
          "component": "AppText",
          "text": "tasks.summary.open"
        },
        {
          "testID": "tasks.task-row.{taskId}",
          "role": "checkbox",
          "component": "PressableSurface",
          "note": "One row per task, keyed by the task id; the row is the checkbox."
        }
      ]
    },
    {
      "id": "lists",
      "name": "Lists",
      "presentation": "route",
      "route": "src/app/(app)/lists.tsx",
      "model": "src/features/lists/use-lists-model.ts",
      "view": "src/features/lists/lists-screen.tsx",
      "states": [
        {
          "id": "default"
        },
        {
          "id": "empty",
          "drawn": false,
          "why": "Chosen: a first launch has no lists; a title and one line, no picture."
        },
        {
          "id": "error",
          "drawn": false,
          "why": "Chosen: the lists could not be read; the message and one Try again action at the bottom."
        }
      ],
      "elements": [
        {
          "testID": "lists.screen",
          "role": "none",
          "component": "View"
        },
        {
          "testID": "lists.list",
          "role": "list",
          "component": "FlatList",
          "states": ["default"]
        },
        {
          "testID": "lists.list-row.{listId}",
          "role": "none",
          "component": "View",
          "states": ["default"],
          "note": "One row per list, keyed by the list id; the list's name is data text. Not accessible itself, so its delete button stays reachable."
        },
        {
          "testID": "lists.list-row.{listId}.delete-button",
          "role": "button",
          "component": "PressableSurface",
          "text": "lists.list-row.delete-button.text",
          "a11yLabel": "lists.list-row.delete-button.label",
          "states": ["default"]
        },
        {
          "testID": "lists.empty-title",
          "role": "header",
          "component": "AppText",
          "text": "lists.empty.title",
          "states": ["empty"]
        },
        {
          "testID": "lists.empty-body",
          "role": "text",
          "component": "AppText",
          "text": "lists.empty.body",
          "states": ["empty"]
        },
        {
          "testID": "lists.error-note",
          "role": "text",
          "component": "AppText",
          "text": "lists.error.body",
          "states": ["error"]
        },
        {
          "testID": "lists.retry-button",
          "role": "button",
          "component": "PressableSurface",
          "text": "lists.retry-button.label",
          "states": ["error"]
        }
      ],
      "notes": "The navigation title (lists.title) is set by the route through the Stack header. The delete dialog is its own screen (delete-list-dialog)."
    },
    {
      "id": "delete-list-dialog",
      "name": "Delete list",
      "presentation": "dialog",
      "model": "src/features/lists/use-lists-model.ts",
      "view": "src/features/lists/delete-list-dialog/delete-list-dialog.tsx",
      "states": [
        {
          "id": "default"
        }
      ],
      "elements": [
        {
          "testID": "delete-list-dialog.scrim",
          "role": "none",
          "component": "View",
          "note": "The modal root: accessibilityViewIsModal sits here, never on the card."
        },
        {
          "testID": "delete-list-dialog.card",
          "role": "none",
          "component": "View"
        },
        {
          "testID": "delete-list-dialog.title",
          "role": "header",
          "component": "AppText",
          "text": "lists.delete-dialog.title"
        },
        {
          "testID": "delete-list-dialog.body",
          "role": "text",
          "component": "AppText",
          "text": "lists.delete-dialog.body"
        },
        {
          "testID": "delete-list-dialog.cancel-button",
          "role": "button",
          "component": "PressableSurface",
          "text": "lists.delete-dialog.cancel"
        },
        {
          "testID": "delete-list-dialog.confirm-button",
          "role": "button",
          "component": "PressableSurface",
          "text": "lists.delete-dialog.confirm"
        }
      ],
      "notes": "Opened by the Lists model (onAskDelete) and drawn by the Lists screen while a delete is pending; its copy is translated in that model, so \"model\" names it."
    }
  ]
}
